,Name,Timestamp,Index,Video_Title,Video_ID,Video_URL,Channel_Name,Channel_URL,Description,Publish_Date,Category,View_Count,Like_Count,Dislike_Count,Comment_Count,Classification,hispanicmale24_Search_Appearance,hispanicmale24_Page,hispanicmale24_Ranking,hispanicfemale24_Search_Appearance,hispanicfemale24_Page,hispanicfemale24_Ranking,whitemale24_Search_Appearance,whitemale24_Page,whitemale24_Ranking,whitefemale24_Search_Appearance,whitefemale24_Page,whitefemale24_Ranking,africanamericanmale24_Search_Appearance,africanamericanmale24_Page,africanamericanmale24_Ranking,africanamericanfemale24_Search_Appearance,africanamericanfemale24_Page,africanamericanfemale24_Ranking,whitemale24_2_Search_Appearance,whitemale24_2_Page,whitemale24_2_Ranking,whitefemale24_2_Search_Appearance,whitefemale24_2_Page,whitefemale24_2_Ranking,hispanicmale16_Search_Appearance,hispanicmale16_Page,hispanicmale16_Ranking,hispanicfemale16_Search_Appearance,hispanicfemale16_Page,hispanicfemale16_Ranking,whitemale16_Search_Appearance,whitemale16_Page,whitemale16_Ranking,whitefemale16_Search_Appearance,whitefemale16_Page,whitefemale16_Ranking,whitemale16_2_Search_Appearance,whitemale16_2_Page,whitemale16_2_Ranking,whitefemale16_2_Search_Appearance,whitefemale16_2_Page,whitefemale16_2_Ranking,africanamericanmale16_Search_Appearance,africanamericanmale16_Page,africanamericanmale16_Ranking,africanamericanfemale16_Search_Appearance,africanamericanfemale16_Page,africanamericanfemale16_Ranking,electronic_cigarette_search,e-cigarette_search,e-cig_search,vape_search,vaping_search,e-liquid_search,e-juice_search,vape_pods_search,vape_mods_search,cigalikes_search,box_mods_search,vape_pens_search,pod_mods_search,disposable_vape_search,disposable_e-cigs_search,disposables_search,vape_juice_search,ends_search,has_label_0,has_label_1,has_label_2,has_label_3,has_label_4,has_label_5,has_label_6,has_label_7,has_labels,has_label_8,has_label_9,has_label_10,has_label_11,has_label_12,has_label_13,has_label_14,model 3
0,Alex,2020-11-08 17:08:49.592002,1776,Pirates of the Caribbean: At World's End (2007) Official Trailer #1 - Johnny Depp Movie HD,HKSZtp_OGHY,https://www.youtube.com/watch?v=HKSZtp_OGHY,Movieclips Classic Trailers,https://www.youtube.com/channel/UCTCjFFoX1un-j7ni4B6HJ3Q,"subscribe to trailers: http://bit.ly/sxaw6h
subscribe to coming soon: http://bit.ly/h2vzun
subscribe to classic trailers: http://bit.ly/1u43jde
like us on facebook: http://goo.gl/dhs73
follow us on twitter: http://bit.ly/1ghowmt
pirates of the caribbean: at world's end (2007) official trailer #1 - johnny depp movie hd


captain barbossa, will turner and elizabeth swann must sail off the edge of the map, navigate treachery and betrayal, and make their final alliances for one last decisive battle.",2013-11-14T08:05:55Z,Film & Animation,2065666,10579.0,182.0,772.0,[],True,4.0,9.0,True,4.0,14.0,True,5.0,7.0,True,3.0,15.0,False,,,True,3.0,17.0,True,4.0,2.0,True,4.0,2.0,True,3.0,11.0,False,,,True,4.0,6.0,True,4.0,0.0,True,4.0,5.0,True,3.0,15.0,True,4.0,5.0,True,4.0,17.0,False,False,False,False,False,False,False,False,False,False,False,False,False,False,False,False,False,True,False,False,False,False,False,False,True,False,True,False,False,False,False,False,False,False,6
0,Alex,2020-11-08 17:09:46.858960,2387,Red in Motion: Vaporized E-Cigarette Liquids Induce Ion Transport Dysfunction in Airway Epithelia,D1Lnl2PhAQ0,https://www.youtube.com/watch?v=D1Lnl2PhAQ0,American Thoracic Society,https://www.youtube.com/channel/UCDc0y8drGNLyPphDEWSR3eQ,"in a new study published in the american journal of respiratory and critical care medicine, researchers dug deeper into the potential risks of the long-term use of e-cigarettes. read the article here to find out more: https://www.atsjournals.org/doi/10.1165/rcmb.2017-0432oc",2020-06-09T15:26:55Z,Nonprofits & Activism,45,5.0,0.0,0.0,['marijuana'],False,,,False,,,False,,,False,,,True,2.0,12.0,False,,,False,,,False,,,False,,,False,,,False,,,False,,,False,,,False,,,False,,,False,,,False,True,False,False,False,False,False,False,False,False,False,False,False,False,False,False,False,False,False,False,False,True,False,False,False,False,True,False,False,False,False,False,False,False,3
