,Name,Timestamp,Index,Video_Title,Video_ID,Video_URL,Channel_Name,Channel_URL,Description,Publish_Date,Category,View_Count,Like_Count,Dislike_Count,Comment_Count,Classification,hispanicmale24_Search_Appearance,hispanicmale24_Page,hispanicmale24_Ranking,hispanicfemale24_Search_Appearance,hispanicfemale24_Page,hispanicfemale24_Ranking,whitemale24_Search_Appearance,whitemale24_Page,whitemale24_Ranking,whitefemale24_Search_Appearance,whitefemale24_Page,whitefemale24_Ranking,africanamericanmale24_Search_Appearance,africanamericanmale24_Page,africanamericanmale24_Ranking,africanamericanfemale24_Search_Appearance,africanamericanfemale24_Page,africanamericanfemale24_Ranking,whitemale24_2_Search_Appearance,whitemale24_2_Page,whitemale24_2_Ranking,whitefemale24_2_Search_Appearance,whitefemale24_2_Page,whitefemale24_2_Ranking,hispanicmale16_Search_Appearance,hispanicmale16_Page,hispanicmale16_Ranking,hispanicfemale16_Search_Appearance,hispanicfemale16_Page,hispanicfemale16_Ranking,whitemale16_Search_Appearance,whitemale16_Page,whitemale16_Ranking,whitefemale16_Search_Appearance,whitefemale16_Page,whitefemale16_Ranking,whitemale16_2_Search_Appearance,whitemale16_2_Page,whitemale16_2_Ranking,whitefemale16_2_Search_Appearance,whitefemale16_2_Page,whitefemale16_2_Ranking,africanamericanmale16_Search_Appearance,africanamericanmale16_Page,africanamericanmale16_Ranking,africanamericanfemale16_Search_Appearance,africanamericanfemale16_Page,africanamericanfemale16_Ranking,electronic_cigarette_search,e-cigarette_search,e-cig_search,vape_search,vaping_search,e-liquid_search,e-juice_search,vape_pods_search,vape_mods_search,cigalikes_search,box_mods_search,vape_pens_search,pod_mods_search,disposable_vape_search,disposable_e-cigs_search,disposables_search,vape_juice_search,ends_search,has_label_0,has_label_1,has_label_2,has_label_3,has_label_4,has_label_5,has_label_6,has_label_7,has_labels,has_label_8,has_label_9,has_label_10,has_label_11,has_label_12,has_label_13,has_label_14,model 2
0,Alex,2020-11-16 17:51:09.250959,2231,E-cigarette explodes on bus,EuYtGhLkSKk,https://www.youtube.com/watch?v=EuYtGhLkSKk,FOX 5 Atlanta,https://www.youtube.com/channel/UCjHWv2DU5-HLpogAAr386DQ,"it was terrifying moments for a california man on wednesday when his e-cigarette exploded in his pocket.

the incident was caught on surveillance video.  it happened on a city bus in fresno.  the footage shows the victim sitting down before the explosion.  the blast set his leg on fire.

the 53-year-old man suffered minor burns to his right thigh and hand.


it is just the latest in a string of exploding e-cigarettes.  just last month, a man in new york's grand central terminal suffered leg and hand burns after his e-cigarette exploded in his pants pocket.

the u.s. food and drug administration, which started regulating e-cigarettes in may, said it received reports about 66 explosions in 2015 and early 2016, after recording 92 explosions from 2009 to september 2015

sen. charles schumer (d-ny) has called e-cigarettes ""ticking time bombs"" and wants the federal government to consider recalling the batteries that run them.

last year, the federal department of transportation issued a rule prohibiting passengers from packing e-cigarettes in checked luggage to protect against in-flight fires.",2016-12-23T04:45:43Z,News & Politics,6661,14.0,5.0,3.0,[],False,,,False,,,False,,,True,5.0,6.0,False,,,False,,,True,5.0,6.0,False,,,False,,,False,,,False,,,False,,,False,,,False,,,False,,,False,,,False,True,False,False,False,False,False,False,False,False,False,False,False,False,False,False,False,False,False,False,False,False,False,False,False,False,True,False,True,False,False,False,False,False,9
0,Alex,2020-11-16 17:54:21.939515,2768,TUG Boat disposable vape pen,znZP0GyDgXM,https://www.youtube.com/watch?v=znZP0GyDgXM,Jeff Xiang,https://www.youtube.com/channel/UCutZ8KGNgxIWtePscGHIr2g,"original tug boat vape pen with high quality.
whatsapp us for quotation: +86 15013650968
get one from our dhgate store:https://www.dhgate.com/store/21281070?extid=gmppyndboh79sqnsp6a+erknjexflpqhlibe6lg7ulwrf2fmu451aa==",2019-07-15T08:13:33Z,People & Blogs,9400,38.0,3.0,24.0,[],False,,,False,,,False,,,False,,,True,7.0,12.0,False,,,False,,,False,,,True,7.0,5.0,False,,,False,,,False,,,False,,,False,,,False,,,False,,,False,False,False,False,False,False,False,False,False,False,False,False,False,True,False,False,False,False,False,False,False,False,False,False,True,False,True,False,False,False,False,False,False,False,6
0,Alex,2020-11-16 17:55:58.019823,2788,DISPOSABLE DAB PEN !?,Xq6Qsj-MCeU,https://www.youtube.com/watch?v=Xq6Qsj-MCeU,LoudFam Productions,https://www.youtube.com/channel/UChm6CQ0QScqtuvVpgF0sm0A,"this thing is siiickkk my guy ya tu sabe💯 stay lit #loudfam shit had me dyinggg haha 

 ———like , comment , subscribe ———

follow my social media -- 

snapchat --- soloud710

instagram ---  https://instagram.com/soloud710?igshid=24hvr1sagrmc

my backup instagram --- https://instagram.com/solouddd710?igshid=wd7erz7ls76k",2020-02-29T23:43:23Z,People & Blogs,18782,520.0,34.0,13.0,[],False,,,False,,,False,,,False,,,True,1.0,13.0,False,,,False,,,False,,,False,,,False,,,False,,,False,,,False,,,False,,,False,,,False,,,False,False,False,False,False,False,False,False,False,False,False,False,False,False,False,True,False,False,False,False,False,False,False,False,True,False,True,False,False,False,False,False,False,False,6
