,Name,Timestamp,Index,Video_Title,Video_ID,Video_URL,Channel_Name,Channel_URL,Description,Publish_Date,Category,View_Count,Like_Count,Dislike_Count,Comment_Count,Classification,hispanicmale24_Search_Appearance,hispanicmale24_Page,hispanicmale24_Ranking,hispanicfemale24_Search_Appearance,hispanicfemale24_Page,hispanicfemale24_Ranking,whitemale24_Search_Appearance,whitemale24_Page,whitemale24_Ranking,whitefemale24_Search_Appearance,whitefemale24_Page,whitefemale24_Ranking,africanamericanmale24_Search_Appearance,africanamericanmale24_Page,africanamericanmale24_Ranking,africanamericanfemale24_Search_Appearance,africanamericanfemale24_Page,africanamericanfemale24_Ranking,whitemale24_2_Search_Appearance,whitemale24_2_Page,whitemale24_2_Ranking,whitefemale24_2_Search_Appearance,whitefemale24_2_Page,whitefemale24_2_Ranking,hispanicmale16_Search_Appearance,hispanicmale16_Page,hispanicmale16_Ranking,hispanicfemale16_Search_Appearance,hispanicfemale16_Page,hispanicfemale16_Ranking,whitemale16_Search_Appearance,whitemale16_Page,whitemale16_Ranking,whitefemale16_Search_Appearance,whitefemale16_Page,whitefemale16_Ranking,whitemale16_2_Search_Appearance,whitemale16_2_Page,whitemale16_2_Ranking,whitefemale16_2_Search_Appearance,whitefemale16_2_Page,whitefemale16_2_Ranking,africanamericanmale16_Search_Appearance,africanamericanmale16_Page,africanamericanmale16_Ranking,africanamericanfemale16_Search_Appearance,africanamericanfemale16_Page,africanamericanfemale16_Ranking,electronic_cigarette_search,e-cigarette_search,e-cig_search,vape_search,vaping_search,e-liquid_search,e-juice_search,vape_pods_search,vape_mods_search,cigalikes_search,box_mods_search,vape_pens_search,pod_mods_search,disposable_vape_search,disposable_e-cigs_search,disposables_search,vape_juice_search,ends_search,has_label_0,has_label_1,has_label_2,has_label_3,has_label_4,has_label_5,has_label_6,has_label_7,has_labels,has_label_8,has_label_9,has_label_10,has_label_11,has_label_12,has_label_13,has_label_14,model 3
0,Alex,2020-11-24 17:52:19.887915,3276,Exploring the secret world of vaporizer tricks and mods,wqplhtADAzc,https://www.youtube.com/watch?v=wqplhtADAzc,The Verge,https://www.youtube.com/channel/UCddiUEpeqJcYeBxX1IVBKvQ,"last week, the e-cigarette industry had a run-in with the girl scouts. the issue? thin mint-flavored e-liquid. wacky flavors are a huge part of the culture that has cropped up around nicotine vaporizers, but it doesn't stop there. in addition to creating their own custom flavors, vapers like to tamper with the insides of their devices to make what are called ""mods."" it's sort of like rolling your own cigarettes rather than buying packs. vape shops do a robust business in ""rebuildable"" devices, while the internet offers endless youtube videos and forum posts explaining how to alter the atomizer to get a stronger flavor or tweak the battery to get a deeper puff. just be careful it doesn't explode.",2014-05-28T13:08:31Z,Science & Technology,243380,904.0,176.0,146.0,"['marijuana', 'tutorial', 'tricks']",False,,,False,,,False,,,False,,,False,,,False,,,False,,,False,,,False,,,True,5.0,10.0,False,,,False,,,False,,,False,,,False,,,False,,,False,False,False,False,False,False,False,False,True,False,False,False,False,False,False,False,False,False,False,False,False,False,False,False,True,False,True,False,False,False,False,False,False,False,6
0,Alex,2020-11-24 17:54:20.338653,2253,Vaping Valerian Root in Your Ascent Vaporizer - You Can Vape What?!,8t8shEaXkH8,https://www.youtube.com/watch?v=8t8shEaXkH8,DaVinci Vaporizer,https://www.youtube.com/channel/UCTHbbC9ONjmD58YXpfcCCkw,"http://www.davincivaporizer.com - on this episode of ""you can vape what?!"", we'll show you how you can vape valerian root with the ascent portable vaporizer. click now to see the video.

valerian root has a ton of beneficial properties and is commonly said to have a sedative effect.

to start, load your bowl with your favorite organic valerian root. close it up and power on. bring the temperature up to 400 fahrenheit or 220 celsius and you're ready to vape.

thanks for watching everybody! for more vape and aromatherapy content be sure to subscribe to our channel. feel free to check out our site at http://www.davincivaporizer.com today! 



** show us some love **

feel free to share your thoughts by commenting below or

drop us a like on facebook: https://www.facebook.com/davincivaporizer

follow us on twitter: https://twitter.com/davincivape",2015-12-24T08:30:01Z,Education,4571,23.0,0.0,10.0,[],False,,,False,,,False,,,True,7.0,9.0,False,,,False,,,False,,,False,,,False,,,False,,,False,,,False,,,False,,,False,,,False,,,False,,,False,False,False,False,True,False,False,False,False,False,False,False,False,False,False,False,False,False,False,False,False,False,False,False,True,False,True,False,False,False,False,False,False,False,6
0,Alex,2020-11-24 17:55:29.644772,3098,Tutorial - How to Refill your Electronic Cigarette,-fPrR_A66vg,https://www.youtube.com/watch?v=-fPrR_A66vg,blu UK,https://www.youtube.com/channel/UCEpWeAfwhcY0kx6eKezZlgQ,"learn how to refill your electronic cigarette with blu.
 
the how to refill your electronic cigarette video is an instructional video featuring the blu pro® e-cigarette model.

be sure to watch carefully and take advantage of the useful tips to help you get the most from your blu pro® e-cigarette and blu pro® clearomiser.

overview

electronic cigarettes, more commonly known as e-cigarettes or vapes, can be confusing if you’re not entirely sure of how they work.

tackling this, our instructional video explains and demonstrates how to refill your electronic cigarette and the best ways to avoid leaking e-liquid. 

to get started, all you’ll need is some paper towels, your chosen blu® liquid flavour and of course your blu pro® e-cigarette. everything else is fully explained in the video.

for more top tips on taking care of your blu® e-cigarette, subscribe to our youtube channel today and keep up-to-date with the latest e-cigarette tips and tricks from blu.",2017-02-21T14:27:59Z,Howto & Style,994,2.0,1.0,0.0,"['tutorial', 'tricks']",False,,,False,,,False,,,False,,,False,,,False,,,False,,,False,,,True,7.0,11.0,False,,,False,,,False,,,False,,,False,,,False,,,False,,,True,False,False,False,False,False,False,False,False,False,False,False,False,False,False,False,False,False,False,False,False,False,False,False,True,False,True,False,False,False,False,False,False,False,6
0,Alex,2020-11-24 17:56:00.361672,2345,Elton John - Club At The End Of The Street,m34NGreosnE,https://www.youtube.com/watch?v=m34NGreosnE,EltonJohnVEVO,https://www.youtube.com/channel/UCI8Ry7NdFNLel-S8dWU7mDA,"“club at the end of the street” was the third single from elton’s 1989 album, sleeping with the past. the video was released in april 1990, created by over a half-dozen animators and director derek hayes at animation city in london.

explore the music of elton john: https://eltonjohn.lnk.to/essentialsid

buy diamonds 2cd: https://eltonjohn.lnk.to/diamondsid
buy diamonds deluxe boxset: https://eltonjohn.lnk.to/diamondsdeluxeid
buy diamonds vinyl: https://eltonjohn.lnk.to/diamondsvinylid
   
watch more elton videos: https://eltonjohn.lnk.to/watchmore
subscribe to elton channel: http://bit.ly/eltonytsubscribe
 
about elton john: 
welcome to the official elton john channel. subscribe today for a vast video collection of music videos, iconic live performances, exclusive interviews, behind the scenes content and playlists to explore elton’s musical legacy in-depth.
 
follow elton john on...
facebook: https://eltonjohn.lnk.to/facebookyt
twitter: https://eltonjohn.lnk.to/twitteryt
instagram: https://eltonjohn.lnk.to/instayt
official website: https://eltonjohn.lnk.to/websiteofficial
join the rocket club newsletter: https://eltonjohn.lnk.to/rocketclub
 
elton john - club at the end of the street
https://www.youtube.com/user/eltonjohn",2016-12-06T10:00:02Z,Music,912386,6236.0,225.0,357.0,[],False,,,False,,,False,,,True,7.0,13.0,False,,,False,,,True,7.0,15.0,False,,,True,7.0,13.0,False,,,False,,,False,,,True,7.0,14.0,True,7.0,12.0,False,,,False,,,False,False,False,False,False,False,False,False,False,False,False,False,False,False,False,False,False,True,False,False,False,False,False,True,False,False,True,False,False,False,False,False,False,False,5
0,Alex,2020-11-24 17:58:15.702324,513,$15 Vape Juice vs. $500 Vape Juice,bWcTXkyEarQ,https://www.youtube.com/watch?v=bWcTXkyEarQ,Ryan Hall,https://www.youtube.com/channel/UC23zfpquyxJLwpLDDzeBVuQ,"for more information on everything you saw in this video & more, please go here: http://bit.ly/ryanhalltv

my website: https://www.rkhtv.com

twitter https://twitter.com/rkhtv (@rkhtv)
instagram https://www.instagram.com/rkhtvinsta/ (rkhtvinsta)
facebook https://www.facebook.com/rkhtv/",2019-07-05T20:12:28Z,Entertainment,188129,4536.0,89.0,479.0,[],True,1.0,1.0,True,1.0,1.0,True,1.0,1.0,True,1.0,1.0,True,1.0,1.0,True,1.0,1.0,True,1.0,1.0,True,1.0,1.0,True,1.0,1.0,True,1.0,1.0,True,1.0,1.0,True,1.0,3.0,True,1.0,1.0,True,1.0,1.0,True,1.0,1.0,True,1.0,1.0,False,False,False,False,True,True,True,False,False,False,False,False,False,False,False,False,True,False,True,True,False,False,False,False,False,False,True,False,False,False,False,False,False,False,0 1
0,Alex,2020-11-24 17:59:07.738346,1256,VooPoo Vinci 40W Mod Pod - Unboxing & Review,1-8tSpGbYCo,https://www.youtube.com/watch?v=1-8tSpGbYCo,180 SMOKE VAPE STORE,https://www.youtube.com/channel/UCi8p8cIFzikgMA7BD1Q2TIA,"the vinci by voopoo is available from 180 smoke stores across canada, and at https://www.180smoke.ca/voopoo-vinci-40w-pod-mod

for more gear, e-liquid, and vaporizers, visit us at http://www.180smoke.com or http://www.180smoke.ca

thanks for checking us out! 

make sure to subscribe to us! we'll update you on the newest vape mods, vaporizers, tanks and any product we carry in our vape shop.

be sure to stay connected with us through our social media!  we'll keep you updated on all the new products we get and deals we offer.
https://www.instagram.com/180smoke
https://twitter.com/180smoke
https://www.facebook.com/180smoke

the voopoo vinci is a compact 40w mod pod system with stylish and ergonomic design, and a versatile gene.ai chipset powered by a 1500mah internal cell that delivers a superior vaping experience. the rectangular aluminum alloy chassis is lightweight and durable with comfortable to grip beveled edges, and the side inlay panels are strikingly colorful. the magnetic pod attaches firmly to the base and has a side fill port with large silicone plug, capacity for 5.5ml e-liquid, and a wide built in mouthpiece. the pod is compatible with the pnp series of dl, half-dl, and ml press fit coils, and the draw is determined by the direction which the pod is installed - facing the fill plug toward the front leaves all three airflow channels on each side unplugged for an open direct to lung draw; and turning the pod with the fill port facing the back plugs 2.5 of each of the channels on both sides, leaving only half one one exposed for a tight mtl draw. the kit includes a pnp-vm1 dl 0.3ω mesh coil rated for 32-40w recommended for use with freebase nicotine e-liquids under 10mg and a pnp-r1 half-dl 0.8ω dual coil rated for 12-18w and recommended for use with nicotine salt e-juices under 35mg.


the vinci's gene.ai chipset supports button firing and automatic draw activation, and has a 2 week puff curve that tracks use for the last 14 days. device settings can be easily adjusted using the +/- buttons mounted below a 0.96"" tft color screen, and variable wattage is supported for 5 - 40w for atomizers in the range of 0.1 - 3.0ω. the micro usb charging port is bottom mounted and supports 5v/1a quick charge under 90min.",2019-10-22T21:33:44Z,Science & Technology,26977,171.0,9.0,16.0,['EVALI'],True,3.0,4.0,True,3.0,1.0,True,3.0,8.0,True,3.0,9.0,True,5.0,4.0,True,3.0,4.0,True,3.0,12.0,True,3.0,7.0,False,,,True,5.0,12.0,True,3.0,9.0,False,,,False,,,False,,,True,3.0,8.0,False,,,False,False,False,False,False,False,False,False,False,False,False,False,True,False,False,False,False,False,True,True,False,False,False,False,False,False,True,False,False,False,False,False,False,False,0 1
