,Name,Timestamp,Index,Video_Title,Video_ID,Video_URL,Channel_Name,Channel_URL,Description,Publish_Date,Category,View_Count,Like_Count,Dislike_Count,Comment_Count,Classification,hispanicmale24_Search_Appearance,hispanicmale24_Page,hispanicmale24_Ranking,hispanicfemale24_Search_Appearance,hispanicfemale24_Page,hispanicfemale24_Ranking,whitemale24_Search_Appearance,whitemale24_Page,whitemale24_Ranking,whitefemale24_Search_Appearance,whitefemale24_Page,whitefemale24_Ranking,africanamericanmale24_Search_Appearance,africanamericanmale24_Page,africanamericanmale24_Ranking,africanamericanfemale24_Search_Appearance,africanamericanfemale24_Page,africanamericanfemale24_Ranking,whitemale24_2_Search_Appearance,whitemale24_2_Page,whitemale24_2_Ranking,whitefemale24_2_Search_Appearance,whitefemale24_2_Page,whitefemale24_2_Ranking,hispanicmale16_Search_Appearance,hispanicmale16_Page,hispanicmale16_Ranking,hispanicfemale16_Search_Appearance,hispanicfemale16_Page,hispanicfemale16_Ranking,whitemale16_Search_Appearance,whitemale16_Page,whitemale16_Ranking,whitefemale16_Search_Appearance,whitefemale16_Page,whitefemale16_Ranking,whitemale16_2_Search_Appearance,whitemale16_2_Page,whitemale16_2_Ranking,whitefemale16_2_Search_Appearance,whitefemale16_2_Page,whitefemale16_2_Ranking,africanamericanmale16_Search_Appearance,africanamericanmale16_Page,africanamericanmale16_Ranking,africanamericanfemale16_Search_Appearance,africanamericanfemale16_Page,africanamericanfemale16_Ranking,electronic_cigarette_search,e-cigarette_search,e-cig_search,vape_search,vaping_search,e-liquid_search,e-juice_search,vape_pods_search,vape_mods_search,cigalikes_search,box_mods_search,vape_pens_search,pod_mods_search,disposable_vape_search,disposable_e-cigs_search,disposables_search,vape_juice_search,ends_search,has_label_0,has_label_1,has_label_2,has_label_3,has_label_4,has_label_5,has_label_6,has_label_7,has_label_8,has_label_9,has_labels,has_label_10,has_label_11,has_label_12,has_label_13,has_label_14,Comment,model 1
0,ALEX,2020-11-17 22:26:27.979947,1211,G Pen Nova Review: Grenco Science's Latest Vape Pen for Wax,_oTXHsNCQCc,https://www.youtube.com/watch?v=_oTXHsNCQCc,DabConnection,https://www.youtube.com/channel/UCYWbcZhLCu5YSNyqAuAkA-Q,"the g pen nova is grenco science's newest vape pen. the g pen nova is good for the price, but does have some reclaim issues. here's a rundown of our g pen nova review:

pros:

smooth and tasty hits
discreet with a sleek design
no hassle to clean
long lasting battery

cons:

collects a lot of reclaim
takes time to heat up
gets dirty often
mouth piece detaches apart without intention

recommendations: design the atomizer so it doesn't collect as much reclaim around it. also, giving it a stronger atomizer for stronger hits would make it better.

see our in depth written review here:

https://dabconnection.com/reviews/vape-pens/g-pen-nova/

cheapest g pen nova is currently at king pen vapes:

https://kingpenvapes.com/g-pen-nova-herb-wax-vape/

use coupon code kpv15 for 15% off to make it the lowest cost on the internet for this product.",2018-11-27T21:22:57Z,Science & Technology,75828,248.0,82.0,123.0,['marijuana'],True,7.0,3.0,True,7.0,8.0,True,7.0,10.0,True,7.0,3.0,False,,,True,7.0,3.0,True,7.0,2.0,True,7.0,6.0,True,4.0,17.0,False,,,True,7.0,1.0,True,7.0,9.0,True,7.0,3.0,False,,,True,7.0,1.0,False,,,False,False,False,False,False,False,False,False,False,False,False,True,False,False,False,False,False,False,False,False,False,False,False,True,False,False,False,False,True,False,False,False,False,False,weed devices review website ,5
0,ALEX,2020-11-17 22:27:39.530202,3133,Man suffers burns after e-cigarette explodes,G6EUB9hOn6k,https://www.youtube.com/watch?v=G6EUB9hOn6k,ABC15 Arizona,https://www.youtube.com/channel/UCIVk1L1-JmpdiGuZcVjImtA,"on monday, lori kimmel says, her husband was walking up to a wendy's near frank lloyd wright and the loop 101.  he had just climbed out of his truck when he felt his leg start to get warm.  he looked down to see sparks flying from the bottom of his shorts and felt the excruciating pain of his skin burning.",2018-09-01T01:27:38Z,News & Politics,271,1.0,0.0,4.0,[],False,,,False,,,False,,,False,,,False,,,False,,,False,,,False,,,True,4.0,14.0,False,,,False,,,False,,,True,4.0,6.0,False,,,True,4.0,6.0,False,,,False,False,False,False,False,False,False,False,False,True,False,False,False,False,False,False,False,False,False,False,True,False,False,False,False,False,False,False,True,False,False,False,False,False,,2
