0,Alex,2020-12-04 22:48:19.360470,How safe is vaping? | 7.30,BaTWfRoUjeU,https://www.youtube.com/watch?v=BaTWfRoUjeU,ABC News (Australia),https://www.youtube.com/channel/UCVgO39Bk5sMo66-6o6Spn6Q,"a new study says it is as harmful as smoking, but some doctors are still offering it as a better alternative to cigarettes.

read more here: https://www.abc.net.au/news/2019-11-05/vaping-as-harmful-as-cigarettes-study-finds/11669434

for more from abc news, click here: https://ab.co/2kxyczy
if you're in australia, you can watch more abc news content on iview: https://ab.co/2mge4kh

subscribe to us on youtube: http://ab.co/1svxlve
go deeper on our abc news in-depth channel: https://ab.co/2lnebn2
you can also like us on facebook: http://facebook.com/abcnews.au
or follow us on instagram: http://instagram.com/abcnews_au
or even on twitter: http://twitter.com/abcnews",2019-11-05T01:00:00Z,News & Politics,12761,154.0,77.0,,[],True,2.0,10.0,True,4.0,11.0,True,3.0,9.0,True,4.0,17.0,False,,,True,5.0,2.0,True,4.0,19.0,True,2.0,2.0,True,4.0,15.0,True,2.0,12.0,True,4.0,7.0,True,2.0,5.0,True,1.0,14.0,True,2.0,3.0,True,5.0,0.0,True,6.0,8.0,False,False,False,True,True,False,False,False,False,False,False,False,False,False,False,False,False,False,False,False,False,True,True,False,False,False,False,False,False,False,False,False,False,False,,350.0,3
